{
  "project_id": "bmtc-electric-buses",
  "date": "2026-09-07",
  "type": "sanctioned",
  "summary": "Karnataka Cabinet approved procurement of 4,500 electric buses for BMTC under the PM E-DRIVE scheme; state expenditure estimated at roughly ₹600 crore a year (~₹12,000 crore over 20 years), with a further ₹2,000 crore central loan sought for depot development.",
  "source_id": "S16"
}
