{
  "project_id": "peripheral-ring-road",
  "date": "2021-10-26",
  "type": "stalled",
  "summary": "Supreme Court order recorded that of the 1,810 acres 18.5 guntas notified for PRR Part 1, only 3 acres 21 guntas had actually been taken possession of; the Court directed the state government to hand over notified government land to BDA and directed BDA to simultaneously pass awards and take possession of notified land.",
  "source_id": "S30"
}
