{
  "project_id": "metro-phase-3",
  "date": "2026-01-14",
  "type": "tender_floated",
  "summary": "BMRCL invited civil construction bids for the first 18.581 km of the Orange Line in three packages (JP Nagar 4th Phase–Kamakya, Hosekerehalli–Nagarbhavi Circle, Vinayaka Layout–BDA Complex Nagarbhavi), combined estimated cost ₹4,187.41 crore. Bid submission deadline 2026-02-25.",
  "source_id": "S10"
}
