{
  "project_id": "pink-line",
  "date": "2021-02-04",
  "type": "stalled",
  "summary": "BMRCL terminated Simplex Infrastructures' ₹578.70 crore Reach 6 elevated-section contract citing poor progress — civil work had reached about 35-37% completion against a 27-month deadline that began in September 2017.",
  "source_id": "S32"
}
